Image_id,material_image_id,style_tags_boho,style_tags_industrial,style_tags_minimalist,style_tags_scandinavian,material_type_fabric,material_type_glass,material_type_leather,material_type_marble,material_type_metal,material_type_stone,material_type_tile,material_type_wood,clean_design_description,user_preference,color1,color2,color3
463,463,0.0,0.0,0.0,1.0,0.0,0.0,1.0,0.0,0.0,0.0,0.0,0.0,"This bedroom embraces a cozy design, highlighted by classic benches.",prefers light woods and natural fabrics,#C10B85, #E97BAB, #28BD2B
464,464,0.0,1.0,0.0,0.0,0.0,0.0,0.0,0.0,0.0,0.0,1.0,0.0,"The interior of this bedroom uses ceramic feature borders heavily, creating an edgy atmosphere complete with factory-style windows.",likes metal finishes and exposed structures,#D6D746, #D93AD2, #29C11C
465,465,0.0,1.0,0.0,0.0,0.0,0.0,0.0,0.0,1.0,0.0,0.0,0.0,"The interior of this bedroom uses shiny frames heavily, creating a raw atmosphere complete with vintage lighting.",likes metal finishes and exposed structures,#AE02F6, #7CD4B6, #468D45
466,466,0.0,0.0,0.0,1.0,0.0,0.0,0.0,0.0,1.0,0.0,0.0,0.0,A inviting bathroom featuring brushed hardware and simple decor.,likes cozy atmospheres with functional design,#79A5C8, #C5A5B0, #39D7F7
467,467,0.0,0.0,1.0,0.0,0.0,0.0,0.0,0.0,0.0,0.0,1.0,0.0,"The interior of this bedroom uses porcelain bedroom islands heavily, creating a simple atmosphere complete with clean lines.",prefers simplicity and neutral palettes,#A15FE9, #066273, #A29F74
468,468,0.0,0.0,1.0,0.0,0.0,0.0,0.0,1.0,0.0,0.0,0.0,0.0,A clean bedroom featuring classic flooring and hidden storage.,wants a calm and functional design,#FE0D44, #53604F, #2B0FC5
469,469,0.0,0.0,1.0,0.0,0.0,0.0,0.0,0.0,1.0,0.0,0.0,0.0,"Designed with a pure aesthetic, this bedroom showcases heavy hardware alongside hidden storage.",prefers simplicity and neutral palettes,#0BB61A, #61A78D, #09C9E7
470,470,0.0,0.0,0.0,1.0,0.0,0.0,0.0,0.0,0.0,1.0,0.0,0.0,The nordic vibe of this bathroom is perfectly complemented by its natural feature walls.,prefers light woods and natural fabrics,#EF193A, #D395D9, #118396
471,471,0.0,1.0,0.0,0.0,0.0,0.0,1.0,0.0,0.0,0.0,0.0,0.0,"Beautifully styled, this living room offers premium poufs paired with vintage lighting in an utilitarian setting.",likes metal finishes and exposed structures,#C44B4F, #0D847C, #0055B5
472,472,0.0,0.0,1.0,0.0,0.0,0.0,0.0,0.0,0.0,0.0,0.0,1.0,"This bathroom embraces a sleek design, highlighted by oak hardwood floors.",prefers simplicity and neutral palettes,#253F85, #C20CEE, #4A3C06
473,473,0.0,0.0,1.0,0.0,0.0,0.0,0.0,0.0,0.0,1.0,0.0,0.0,"Beautifully styled, this bedroom offers rugged flooring paired with clean lines in a simple setting.",prefers simplicity and neutral palettes,#3C496E, #EBDFD0, #A0FCED
474,474,0.0,0.0,0.0,1.0,0.0,0.0,0.0,0.0,1.0,0.0,0.0,0.0,"The interior of this bathroom uses sturdy bar stools heavily, creating a hygge atmosphere complete with functional layouts.",prefers light woods and natural fabrics,#C12F1B, #026F1C, #7364B8
475,475,0.0,1.0,0.0,0.0,0.0,0.0,1.0,0.0,0.0,0.0,0.0,0.0,"Beautifully styled, this bathroom offers premium upholstery paired with high ceilings in a warehouse-inspired setting.","wants a modern, urban atmosphere",#FA69BE, #620627, #12010E
476,476,0.0,0.0,0.0,1.0,0.0,0.0,0.0,0.0,1.0,0.0,0.0,0.0,The warm vibe of this living room is perfectly complemented by its iron light fixtures.,likes cozy atmospheres with functional design,#759CEB, #CBE73D, #DB7787
477,477,1.0,0.0,0.0,0.0,0.0,0.0,0.0,0.0,1.0,0.0,0.0,0.0,"Designed with a free-spirited aesthetic, this kitchen showcases shiny table legs alongside woven baskets.",prefers natural fabrics and artistic patterns,#A9F778, #8C0258, #921F10
478,478,0.0,1.0,0.0,0.0,0.0,1.0,0.0,0.0,0.0,0.0,0.0,0.0,A unfinished bedroom featuring transparent large windows and high ceilings.,likes metal finishes and exposed structures,#FA6262, #C61416, #2D3590
479,479,1.0,0.0,0.0,0.0,0.0,0.0,0.0,1.0,0.0,0.0,0.0,0.0,"This living room embraces a cozy design, highlighted by cold flooring.",likes vibrant colors and handmade decor,#894579, #F22CA6, #63DE52
480,480,0.0,0.0,0.0,1.0,0.0,0.0,0.0,0.0,0.0,1.0,0.0,0.0,"Beautifully styled, this kitchen offers textured pillars paired with soft textiles in a nordic setting.",wants warm minimalism and neutral colors,#31597E, #A7A4FC, #E7918B
481,481,0.0,0.0,1.0,0.0,0.0,0.0,1.0,0.0,0.0,0.0,0.0,0.0,"This living room embraces a clean design, highlighted by smooth stools.",prefers simplicity and neutral palettes,#C24D95, #067D38, #DAAD71
482,482,0.0,1.0,0.0,0.0,0.0,0.0,0.0,0.0,0.0,0.0,1.0,0.0,"Incorporating open layouts, this unfinished kitchen focuses on ceramic backsplashes to define the kitchen.",prefers raw textures and darker tones,#B41146, #A5FAAA, #3C288D
483,483,0.0,0.0,1.0,0.0,1.0,0.0,0.0,0.0,0.0,0.0,0.0,0.0,The understated vibe of this living room is perfectly complemented by its woven rugs.,prefers simplicity and neutral palettes,#565C50, #12C547, #D43782
484,484,0.0,0.0,0.0,1.0,0.0,0.0,0.0,0.0,0.0,0.0,0.0,1.0,"Designed with an airy aesthetic, this living room showcases walnut dining tables alongside functional layouts.",likes cozy atmospheres with functional design,#33FC44, #6CA59A, #629B56
485,485,1.0,0.0,0.0,0.0,0.0,0.0,0.0,0.0,0.0,0.0,0.0,1.0,"Designed with an eclectic aesthetic, this bedroom showcases pine bed frame alongside colorful rugs.",likes vibrant colors and handmade decor,#6DDDCC, #BE7325, #8704A7
486,486,0.0,0.0,1.0,0.0,0.0,0.0,0.0,0.0,0.0,0.0,1.0,0.0,"The interior of this bedroom uses ceramic shower walls heavily, creating an understated atmosphere complete with monochrome palettes.",prefers simplicity and neutral palettes,#386254, #30392F, #4C5425
487,487,1.0,0.0,0.0,0.0,0.0,1.0,0.0,0.0,0.0,0.0,0.0,0.0,"The interior of this living room uses clear lighting fixtures heavily, creating a relaxed atmosphere complete with woven baskets.",prefers natural fabrics and artistic patterns,#196543, #BEEA04, #D76BBF
488,488,0.0,1.0,0.0,0.0,0.0,0.0,0.0,0.0,0.0,0.0,1.0,0.0,"Incorporating factory-style windows, this warehouse-inspired bathroom focuses on geometric flooring to define the bathroom.",likes metal finishes and exposed structures,#5DD6FE, #38860D, #C9CD07
489,489,1.0,0.0,0.0,0.0,0.0,0.0,0.0,0.0,0.0,0.0,0.0,1.0,A stunning bedroom that mixes woven baskets with walnut bed frames for a truly unconventional feel.,loves eclectic vibes and cozy textures,#675D9D, #83577B, #8BBE7C
490,490,0.0,0.0,1.0,0.0,0.0,0.0,0.0,0.0,0.0,0.0,1.0,0.0,"Designed with a pure aesthetic, this kitchen showcases glossy patios alongside bare walls.",prefers simplicity and neutral palettes,#5A240B, #B2EF9B, #D6AAB8
491,491,0.0,1.0,0.0,0.0,0.0,1.0,0.0,0.0,0.0,0.0,0.0,0.0,"The interior of this kitchen uses sleek mirrors heavily, creating an unfinished atmosphere complete with brick walls.",prefers raw textures and darker tones,#1995F6, #C1768C, #BE9759
492,492,0.0,0.0,0.0,1.0,0.0,0.0,0.0,0.0,0.0,0.0,1.0,0.0,"The interior of this bathroom uses patterned shower walls heavily, creating an airy atmosphere complete with organic forms.",likes cozy atmospheres with functional design,#A79D07, #8DFB37, #E50E8B
493,493,1.0,0.0,0.0,0.0,0.0,0.0,1.0,0.0,0.0,0.0,0.0,0.0,"Beautifully styled, this bedroom offers supple poufs paired with woven baskets in a bohemian setting.",prefers natural fabrics and artistic patterns,#81E2D3, #BB3153, #A304FE
494,494,1.0,0.0,0.0,0.0,0.0,0.0,0.0,0.0,1.0,0.0,0.0,0.0,"Designed with a free-spirited aesthetic, this kitchen showcases heavy hardware alongside layered patterns.",loves eclectic vibes and cozy textures,#99D6EC, #E78EBF, #FB9999
495,495,0.0,1.0,0.0,0.0,0.0,1.0,0.0,0.0,0.0,0.0,0.0,0.0,The raw vibe of this living room is perfectly complemented by its reflective lighting fixtures.,prefers raw textures and darker tones,#4813A9, #62C1A1, #17BDA0
496,496,0.0,0.0,0.0,1.0,0.0,0.0,1.0,0.0,0.0,0.0,0.0,0.0,"Beautifully styled, this living room offers worn sofas paired with indoor greenery in a cozy setting.",prefers light woods and natural fabrics,#B2B481, #8080D6, #26B067
497,497,0.0,0.0,1.0,0.0,0.0,0.0,0.0,1.0,0.0,0.0,0.0,0.0,"Incorporating open bedroom, this uncluttered bedroom focuses on polished coffee tables to define the bedroom.",likes clean lines and clutter-free spaces,#E21D6A, #A93F2E, #139939
498,498,0.0,1.0,0.0,0.0,0.0,0.0,0.0,0.0,1.0,0.0,0.0,0.0,"The interior of this kitchen uses steel frames heavily, creating an utilitarian atmosphere complete with open layouts.","wants a modern, urban atmosphere",#9D6A42, #E4CF09, #750413
499,499,0.0,1.0,0.0,0.0,1.0,0.0,0.0,0.0,0.0,0.0,0.0,0.0,"Beautifully styled, this bathroom offers velvet blankets paired with brick walls in a bold setting.",prefers raw textures and darker tones,#B53513, #DDB053, #113755
500,500,0.0,1.0,0.0,0.0,0.0,0.0,1.0,0.0,0.0,0.0,0.0,0.0,"This living room embraces a raw design, highlighted by smooth accent chairs.","wants a modern, urban atmosphere",#B463BE, #AA0623, #10FBAD
501,501,0.0,0.0,0.0,1.0,0.0,0.0,0.0,1.0,0.0,0.0,0.0,0.0,"Designed with a bright aesthetic, this kitchen showcases classic flooring alongside functional layouts.",prefers light woods and natural fabrics,#D5286D, #F0C6A0, #45E47D
502,502,0.0,0.0,1.0,0.0,0.0,0.0,0.0,0.0,0.0,1.0,0.0,0.0,"Beautifully styled, this kitchen offers earthy steps paired with functional furniture in a clean setting.",prefers simplicity and neutral palettes,#1F7554, #FB0E96, #77FD2F
503,503,1.0,0.0,0.0,0.0,1.0,0.0,0.0,0.0,0.0,0.0,0.0,0.0,"Incorporating macrame wall hangings, this unconventional bedroom focuses on soft draperies to define the bedroom.",likes vibrant colors and handmade decor,#F37964, #4E0CAC, #0C1D35
504,504,0.0,1.0,0.0,0.0,0.0,0.0,0.0,0.0,1.0,0.0,0.0,0.0,"The interior of this kitchen uses industrial table legs heavily, creating a warehouse-inspired atmosphere complete with factory-style windows.",prefers raw textures and darker tones,#B80631, #24CCC9, #D62EEB
505,505,0.0,1.0,0.0,0.0,0.0,0.0,0.0,0.0,0.0,0.0,1.0,0.0,"This bathroom embraces an urban design, highlighted by geometric feature borders.","wants a modern, urban atmosphere",#9CB425, #DC80EA, #7067F2
506,506,1.0,0.0,0.0,0.0,0.0,0.0,0.0,0.0,0.0,1.0,0.0,0.0,"Designed with an unconventional aesthetic, this living room showcases rugged cladding alongside macrame wall hangings.",loves eclectic vibes and cozy textures,#769CCA, #B9E73E, #F37CCA
507,507,0.0,1.0,0.0,0.0,0.0,0.0,0.0,1.0,0.0,0.0,0.0,0.0,The rugged vibe of this kitchen is perfectly complemented by its elegant kitchen vanities.,prefers raw textures and darker tones,#366009, #07A989, #99BFB4
508,508,0.0,0.0,0.0,1.0,0.0,0.0,1.0,0.0,0.0,0.0,0.0,0.0,"The interior of this living room uses supple sofas heavily, creating a functional atmosphere complete with muted colors.",wants warm minimalism and neutral colors,#0DED2E, #179365, #E709C1
509,509,1.0,0.0,0.0,0.0,1.0,0.0,0.0,0.0,0.0,0.0,0.0,0.0,"This kitchen embraces a relaxed design, highlighted by upholstered draperies.",prefers natural fabrics and artistic patterns,#2E15D3, #524617, #1B0AAC
510,510,1.0,0.0,0.0,0.0,0.0,0.0,0.0,0.0,0.0,0.0,0.0,1.0,"Designed with a relaxed aesthetic, this kitchen showcases natural paneling alongside vintage finds.",prefers natural fabrics and artistic patterns,#7901EA, #7DBC05, #41B06D
511,511,0.0,1.0,0.0,0.0,0.0,0.0,1.0,0.0,0.0,0.0,0.0,0.0,"Beautifully styled, this bathroom offers distressed poufs paired with brick walls in an urban setting.",prefers raw textures and darker tones,#83EDDB, #750BBE, #37AF9F
512,512,0.0,0.0,0.0,1.0,0.0,0.0,0.0,0.0,1.0,0.0,0.0,0.0,"Designed with a bright aesthetic, this bathroom showcases steel staircases alongside indoor greenery.",likes cozy atmospheres with functional design,#4C9061, #1D923D, #B1DA2A
513,513,0.0,0.0,0.0,1.0,0.0,0.0,0.0,0.0,0.0,0.0,0.0,1.0,The warm vibe of this bathroom is perfectly complemented by its warm paneling.,likes cozy atmospheres with functional design,#525EA7, #ED559E, #082435
514,514,0.0,0.0,0.0,1.0,0.0,0.0,0.0,0.0,0.0,0.0,1.0,0.0,The warm vibe of this kitchen is perfectly complemented by its geometric patios.,wants warm minimalism and neutral colors,#AA4C11, #1C44A3, #3EA13A
515,515,1.0,0.0,0.0,0.0,0.0,0.0,1.0,0.0,0.0,0.0,0.0,0.0,"This bedroom embraces an earthy design, highlighted by worn benches.",likes vibrant colors and handmade decor,#781103, #11CAA6, #5EF3E8
516,516,0.0,0.0,0.0,1.0,0.0,0.0,0.0,0.0,0.0,1.0,0.0,0.0,"Designed with a nordic aesthetic, this bedroom showcases heavy feature walls alongside indoor greenery.",wants warm minimalism and neutral colors,#6D4C30, #26C861, #40B109
517,517,1.0,0.0,0.0,0.0,0.0,0.0,0.0,0.0,1.0,0.0,0.0,0.0,"Incorporating potted plants, this relaxed living room focuses on brass frames to define the living room.",likes vibrant colors and handmade decor,#F68092, #E18B60, #8F7CC2
518,518,0.0,1.0,0.0,0.0,0.0,0.0,0.0,0.0,0.0,0.0,0.0,1.0,"Beautifully styled, this living room offers walnut shelves paired with brick walls in an unfinished setting.",prefers raw textures and darker tones,#349FBD, #D73B47, #287DA1
519,519,0.0,0.0,0.0,1.0,0.0,0.0,1.0,0.0,0.0,0.0,0.0,0.0,"The interior of this living room uses smooth benches heavily, creating a nordic atmosphere complete with muted colors.",likes cozy atmospheres with functional design,#152353, #3464AA, #5C01EE
520,520,0.0,0.0,0.0,1.0,0.0,0.0,1.0,0.0,0.0,0.0,0.0,0.0,"Incorporating indoor greenery, this airy bathroom focuses on worn accent chairs to define the bathroom.",likes cozy atmospheres with functional design,#FBEDB4, #CAC70C, #E7251B
521,521,1.0,0.0,0.0,0.0,0.0,0.0,0.0,0.0,1.0,0.0,0.0,0.0,"This bathroom embraces a free-spirited design, highlighted by shiny light fixtures.",loves eclectic vibes and cozy textures,#922024, #6DB8CF, #171223
522,522,0.0,0.0,0.0,1.0,0.0,0.0,1.0,0.0,0.0,0.0,0.0,0.0,"Designed with a cozy aesthetic, this bathroom showcases distressed poufs alongside natural light.",prefers light woods and natural fabrics,#9E1F90, #7F209C, #4C0AE6
523,523,1.0,0.0,0.0,0.0,0.0,0.0,0.0,0.0,0.0,0.0,0.0,1.0,"Beautifully styled, this kitchen offers rustic shelves paired with colorful rugs in an unconventional setting.",loves eclectic vibes and cozy textures,#46D624, #494D9F, #F65500
524,524,0.0,1.0,0.0,0.0,0.0,0.0,1.0,0.0,0.0,0.0,0.0,0.0,"Designed with an urban aesthetic, this bedroom showcases worn stools alongside factory-style windows.",likes metal finishes and exposed structures,#F3732F, #DA97CE, #C1B25E
525,525,1.0,0.0,0.0,0.0,0.0,0.0,0.0,1.0,0.0,0.0,0.0,0.0,"Designed with a vibrant aesthetic, this living room showcases polished coffee tables alongside colorful rugs.",loves eclectic vibes and cozy textures,#C85968, #2C7110, #D66965
526,526,1.0,0.0,0.0,0.0,1.0,0.0,0.0,0.0,0.0,0.0,0.0,0.0,A stunning bedroom that mixes layered patterns with soft curtains for a truly cozy feel.,likes vibrant colors and handmade decor,#6A67B0, #F28E55, #FE21C8
527,527,0.0,0.0,0.0,1.0,0.0,0.0,0.0,1.0,0.0,0.0,0.0,0.0,"Beautifully styled, this living room offers veined living room vanities paired with soft textiles in a functional setting.",likes cozy atmospheres with functional design,#0D232B, #CCC07F, #D0911A
528,528,0.0,0.0,1.0,0.0,0.0,0.0,0.0,0.0,0.0,1.0,0.0,0.0,"Beautifully styled, this bathroom offers earthy pillars paired with bare walls in a serene setting.",likes clean lines and clutter-free spaces,#3D7C38, #CE3F34, #472A6F
529,529,1.0,0.0,0.0,0.0,0.0,0.0,0.0,0.0,0.0,0.0,0.0,1.0,A cozy kitchen featuring natural shelves and potted plants.,prefers natural fabrics and artistic patterns,#D74FF4, #2005FD, #92B1A9
530,530,0.0,0.0,1.0,0.0,0.0,0.0,1.0,0.0,0.0,0.0,0.0,0.0,"Incorporating hidden storage, this streamlined bedroom focuses on smooth armchairs to define the bedroom.",likes clean lines and clutter-free spaces,#606FCD, #BAB8D7, #3F1023
531,531,0.0,0.0,0.0,1.0,0.0,0.0,0.0,0.0,0.0,0.0,1.0,0.0,"This bedroom embraces a functional design, highlighted by porcelain feature borders.",likes cozy atmospheres with functional design,#821016, #0A128F, #419043
532,532,0.0,0.0,0.0,1.0,0.0,0.0,1.0,0.0,0.0,0.0,0.0,0.0,A stunning bedroom that mixes muted colors with classic stools for a truly nordic feel.,wants warm minimalism and neutral colors,#8EE9D6, #9893AE, #91013C
533,533,0.0,1.0,0.0,0.0,0.0,0.0,0.0,0.0,0.0,1.0,0.0,0.0,The raw vibe of this kitchen is perfectly complemented by its earthy pillars.,"wants a modern, urban atmosphere",#1F6BA8, #2CDB8E, #58CA7D
534,534,1.0,0.0,0.0,0.0,0.0,0.0,0.0,0.0,0.0,0.0,1.0,0.0,The free-spirited vibe of this kitchen is perfectly complemented by its glossy patios.,loves eclectic vibes and cozy textures,#61B1C3, #DEE162, #B1E911
535,535,0.0,1.0,0.0,0.0,0.0,0.0,0.0,0.0,1.0,0.0,0.0,0.0,"This bathroom embraces a raw design, highlighted by sturdy light fixtures.",likes metal finishes and exposed structures,#8324B8, #A0A467, #AD3E63
536,536,0.0,0.0,0.0,1.0,0.0,0.0,0.0,0.0,0.0,0.0,0.0,1.0,The warm vibe of this bedroom is perfectly complemented by its timber wardrobe.,wants warm minimalism and neutral colors,#70DF86, #161692, #033701
537,537,0.0,0.0,0.0,1.0,0.0,1.0,0.0,0.0,0.0,0.0,0.0,0.0,The warm vibe of this living room is perfectly complemented by its translucent mirrors.,wants warm minimalism and neutral colors,#27934C, #3F9E1F, #3CA189
538,538,0.0,0.0,0.0,1.0,1.0,0.0,0.0,0.0,0.0,0.0,0.0,0.0,"Incorporating simple decor, this hygge kitchen focuses on linen blankets to define the kitchen.",likes cozy atmospheres with functional design,#A8452B, #442839, #206FB5
539,539,1.0,0.0,0.0,0.0,0.0,0.0,1.0,0.0,0.0,0.0,0.0,0.0,"Incorporating woven baskets, this vibrant kitchen focuses on worn poufs to define the kitchen.",loves eclectic vibes and cozy textures,#07CF87, #6CC7DC, #AFA0A0
540,540,1.0,0.0,0.0,0.0,0.0,0.0,0.0,0.0,0.0,0.0,0.0,1.0,"This kitchen embraces an earthy design, highlighted by reclaimed paneling.",prefers natural fabrics and artistic patterns,#0610CE, #51B89B, #BF3612
541,541,0.0,0.0,0.0,1.0,0.0,1.0,0.0,0.0,0.0,0.0,0.0,0.0,"Designed with a warm aesthetic, this kitchen showcases frosted doors alongside natural light.",wants warm minimalism and neutral colors,#07EE36, #271EBA, #F12EAD
542,542,0.0,1.0,0.0,0.0,0.0,1.0,0.0,0.0,0.0,0.0,0.0,0.0,The warehouse-inspired vibe of this kitchen is perfectly complemented by its sleek coffee tables.,prefers raw textures and darker tones,#55F678, #3492BA, #47FC1D
543,543,1.0,0.0,0.0,0.0,0.0,0.0,0.0,0.0,1.0,0.0,0.0,0.0,"Incorporating potted plants, this cozy living room focuses on iron staircases to define the living room.",prefers natural fabrics and artistic patterns,#F1C460, #CDEB12, #8008AD
544,544,0.0,0.0,0.0,1.0,0.0,0.0,0.0,0.0,0.0,0.0,1.0,0.0,"This kitchen embraces a warm design, highlighted by geometric patios.",likes cozy atmospheres with functional design,#A7B66F, #64B5E8, #4AB3D4
545,545,0.0,0.0,0.0,1.0,0.0,0.0,0.0,0.0,0.0,0.0,0.0,1.0,"The interior of this bedroom uses oak cabinetry heavily, creating a cozy atmosphere complete with functional layouts.",likes cozy atmospheres with functional design,#8B6FAB, #C1FA75, #B07124
546,546,0.0,0.0,0.0,1.0,0.0,0.0,0.0,1.0,0.0,0.0,0.0,0.0,"This bathroom embraces a hygge design, highlighted by cold bathroom vanities.",likes cozy atmospheres with functional design,#09A281, #35B57A, #D6FAF8
547,547,0.0,0.0,1.0,0.0,0.0,1.0,0.0,0.0,0.0,0.0,0.0,0.0,"Beautifully styled, this bathroom offers transparent doors paired with clean lines in a pure setting.",likes clean lines and clutter-free spaces,#667D65, #41FE30, #A56A8C
548,548,0.0,1.0,0.0,0.0,0.0,0.0,0.0,1.0,0.0,0.0,0.0,0.0,"Incorporating open layouts, this utilitarian bathroom focuses on veined backsplashes to define the bathroom.","wants a modern, urban atmosphere",#D5E353, #C0AD45, #689BEE
549,549,0.0,0.0,1.0,0.0,0.0,0.0,0.0,0.0,0.0,0.0,0.0,1.0,"Designed with a streamlined aesthetic, this living room showcases reclaimed shelves alongside monochrome palettes.",likes clean lines and clutter-free spaces,#7819F4, #AB901F, #7E64D8
550,550,0.0,0.0,0.0,1.0,0.0,0.0,0.0,0.0,0.0,1.0,0.0,0.0,A functional living room featuring rough steps and indoor greenery.,likes cozy atmospheres with functional design,#F70068, #CAC542, #A190B8
551,551,0.0,0.0,1.0,0.0,1.0,0.0,0.0,0.0,0.0,0.0,0.0,0.0,"This kitchen embraces a sleek design, highlighted by cotton draperies.",prefers simplicity and neutral palettes,#EAC64A, #9590DD, #5ABF18
552,552,0.0,0.0,0.0,1.0,1.0,0.0,0.0,0.0,0.0,0.0,0.0,0.0,The functional vibe of this bathroom is perfectly complemented by its soft armchairs.,likes cozy atmospheres with functional design,#DFAA1C, #2E786A, #6D8FB1
553,553,0.0,1.0,0.0,0.0,0.0,1.0,0.0,0.0,0.0,0.0,0.0,0.0,"This kitchen embraces a rugged design, highlighted by glossy coffee tables.","wants a modern, urban atmosphere",#6A18D2, #F81953, #AF92D4
554,554,0.0,0.0,1.0,0.0,0.0,0.0,0.0,0.0,0.0,0.0,0.0,1.0,"Designed with a streamlined aesthetic, this kitchen showcases oak paneling alongside hidden storage.",wants a calm and functional design,#916F31, #69D14A, #EBDE93
555,555,0.0,0.0,1.0,0.0,0.0,0.0,0.0,1.0,0.0,0.0,0.0,0.0,The understated vibe of this bedroom is perfectly complemented by its polished fireplaces.,prefers simplicity and neutral palettes,#415355, #75E528, #C4354C
556,556,0.0,1.0,0.0,0.0,0.0,0.0,1.0,0.0,0.0,0.0,0.0,0.0,The edgy vibe of this living room is perfectly complemented by its rich sofas.,prefers raw textures and darker tones,#7E292C, #1BECC9, #602856
557,557,1.0,0.0,0.0,0.0,0.0,0.0,0.0,0.0,0.0,0.0,1.0,0.0,"The interior of this bathroom uses mosaic flooring heavily, creating a free-spirited atmosphere complete with potted plants.",loves eclectic vibes and cozy textures,#1793E5, #216F3A, #F45135
558,558,0.0,1.0,0.0,0.0,0.0,0.0,0.0,0.0,0.0,0.0,0.0,1.0,"Beautifully styled, this kitchen offers timber kitchen units paired with high ceilings in a warehouse-inspired setting.","wants a modern, urban atmosphere",#0CBBC6, #D2A463, #4E01B2
559,559,0.0,1.0,0.0,0.0,1.0,0.0,0.0,0.0,0.0,0.0,0.0,0.0,"Beautifully styled, this bathroom offers woven throw pillows paired with factory-style windows in an urban setting.",likes metal finishes and exposed structures,#9A79F1, #32EDC2, #CABB99
560,560,1.0,0.0,0.0,0.0,1.0,0.0,0.0,0.0,0.0,0.0,0.0,0.0,"Incorporating macrame wall hangings, this free-spirited living room focuses on linen sofas to define the living room.",loves eclectic vibes and cozy textures,#FDD582, #4C133C, #6328FF
561,561,0.0,0.0,0.0,1.0,0.0,0.0,0.0,0.0,0.0,0.0,0.0,1.0,"Designed with a warm aesthetic, this living room showcases rustic paneling alongside indoor greenery.",likes cozy atmospheres with functional design,#B2392A, #DDBC9E, #7E0C9F
562,562,0.0,0.0,1.0,0.0,0.0,0.0,1.0,0.0,0.0,0.0,0.0,0.0,"The interior of this kitchen uses worn armchairs heavily, creating a clean atmosphere complete with functional furniture.",wants a calm and functional design,#5E2BD2, #EDB05C, #6FDFAA
563,563,1.0,0.0,0.0,0.0,0.0,0.0,0.0,1.0,0.0,0.0,0.0,0.0,"Beautifully styled, this kitchen offers classic coffee tables paired with vintage finds in a bohemian setting.",loves eclectic vibes and cozy textures,#B2D7D1, #267213, #D7AB38
564,564,0.0,1.0,0.0,0.0,0.0,0.0,0.0,1.0,0.0,0.0,0.0,0.0,A utilitarian bedroom featuring marble decorative tray and factory-style windows.,prefers raw textures and darker tones,#261B3B, #9083DA, #6A88D9
565,565,0.0,1.0,0.0,0.0,0.0,1.0,0.0,0.0,0.0,0.0,0.0,0.0,A stunning kitchen that mixes brick walls with sleek partitions for a truly edgy feel.,"wants a modern, urban atmosphere",#8D3978, #4B48C2, #13A017
566,566,0.0,1.0,0.0,0.0,0.0,0.0,0.0,0.0,0.0,1.0,0.0,0.0,"Incorporating open layouts, this unfinished living room focuses on natural fireplaces to define the living room.",prefers raw textures and darker tones,#826893, #82C037, #C06D28
567,567,0.0,0.0,0.0,1.0,0.0,0.0,0.0,0.0,0.0,0.0,1.0,0.0,"Incorporating simple decor, this bright bedroom focuses on mosaic bedroom islands to define the bedroom.",wants warm minimalism and neutral colors,#8A67D6, #867077, #01FA59
568,568,1.0,0.0,0.0,0.0,0.0,0.0,0.0,0.0,0.0,0.0,0.0,1.0,The earthy vibe of this bathroom is perfectly complemented by its reclaimed shelves.,likes vibrant colors and handmade decor,#E82AD8, #7C2CE1, #9A4397
569,569,0.0,1.0,0.0,0.0,0.0,0.0,0.0,1.0,0.0,0.0,0.0,0.0,The rugged vibe of this kitchen is perfectly complemented by its luxurious kitchen vanities.,likes metal finishes and exposed structures,#D3355C, #BE8808, #B9DF68
570,570,0.0,0.0,0.0,1.0,0.0,0.0,1.0,0.0,0.0,0.0,0.0,0.0,"This bathroom embraces a warm design, highlighted by distressed upholstery.",likes cozy atmospheres with functional design,#0F46DD, #F06864, #C491BE
571,571,0.0,1.0,0.0,0.0,0.0,0.0,1.0,0.0,0.0,0.0,0.0,0.0,"Beautifully styled, this bedroom offers smooth armchairs paired with high ceilings in a raw setting.","wants a modern, urban atmosphere",#CA80C0, #2B3BE9, #F2F19A
572,572,0.0,0.0,0.0,1.0,0.0,0.0,0.0,0.0,0.0,0.0,0.0,1.0,"Designed with a warm aesthetic, this bedroom showcases reclaimed paneling alongside muted colors.",prefers light woods and natural fabrics,#CCD2DB, #22CAFD, #66A1B5
573,573,0.0,1.0,0.0,0.0,0.0,0.0,0.0,0.0,1.0,0.0,0.0,0.0,A edgy living room featuring iron frames and exposed pipes.,prefers raw textures and darker tones,#3190BF, #C8A12F, #4E71E8
574,574,0.0,0.0,1.0,0.0,0.0,0.0,0.0,0.0,1.0,0.0,0.0,0.0,"Beautifully styled, this bedroom offers matte bar stools paired with hidden storage in a simple setting.",wants a calm and functional design,#834D59, #EB78F1, #D5C34F
575,575,1.0,0.0,0.0,0.0,0.0,0.0,0.0,0.0,0.0,0.0,0.0,1.0,"The interior of this kitchen uses pine wood countertops beautifully, creating a relaxed atmosphere complete with woven baskets.",loves eclectic vibes and cozy textures,#C8BEE9, #FB979C, #96AB02
576,576,0.0,0.0,0.0,1.0,0.0,0.0,0.0,1.0,0.0,0.0,0.0,0.0,"Designed with a warm aesthetic, this living room showcases classic accents alongside natural light.",prefers light woods and natural fabrics,#4F1DD8, #F9BA8B, #815312
577,577,0.0,1.0,0.0,0.0,0.0,0.0,0.0,0.0,0.0,0.0,0.0,1.0,The edgy vibe of this kitchen is perfectly complemented by its natural shelves.,prefers raw textures and darker tones,#C64030, #5E4010, #202C38
