Image_id,material_image_id,style_tags_boho,style_tags_industrial,style_tags_minimalist,style_tags_scandinavian,material_type_fabric,material_type_glass,material_type_leather,material_type_marble,material_type_metal,material_type_stone,material_type_tile,material_type_wood,clean_design_description,user_preference,color1,color2,color3
694,694,0.0,0.0,1.0,0.0,0.0,0.0,0.0,0.0,1.0,0.0,0.0,0.0,A serene living room featuring shiny hardware and geometric shapes.,likes clean lines and clutter-free spaces,#246BB9, #1935C4, #DDE8F3
695,695,0.0,0.0,1.0,0.0,0.0,0.0,0.0,0.0,0.0,0.0,0.0,1.0,"Incorporating functional furniture, this streamlined bedroom focuses on solid paneling to define the bedroom.",wants a calm and functional design,#8B458D, #CE94FA, #C06118
696,696,0.0,0.0,0.0,1.0,0.0,0.0,0.0,0.0,0.0,0.0,0.0,1.0,"Incorporating indoor greenery, this warm bedroom focuses on oak cabinetry to define the bedroom.",prefers light woods and natural fabrics,#D2EA8B, #140968, #96E6DE
697,697,1.0,0.0,0.0,0.0,0.0,0.0,0.0,0.0,0.0,1.0,0.0,0.0,"Beautifully styled, this bedroom offers earthy feature walls paired with woven baskets in a cozy setting.",likes vibrant colors and handmade decor,#04F443, #ECDECC, #403B9A
698,698,0.0,0.0,0.0,1.0,0.0,0.0,0.0,0.0,0.0,0.0,0.0,1.0,A stunning kitchen that mixes natural light with reclaimed paneling for a truly nordic feel.,likes cozy atmospheres with functional design,#BF90D4, #37584C, #B02E30
699,699,1.0,0.0,0.0,0.0,0.0,1.0,0.0,0.0,0.0,0.0,0.0,0.0,"The interior of this kitchen uses sleek large windows heavily, creating an earthy atmosphere complete with woven baskets.",likes vibrant colors and handmade decor,#409672, #5D0202, #32E8FA
700,700,1.0,0.0,0.0,0.0,0.0,0.0,1.0,0.0,0.0,0.0,0.0,0.0,"Incorporating woven baskets, this relaxed bedroom focuses on worn poufs to define the bedroom.",prefers natural fabrics and artistic patterns,#24848E, #9BEF1E, #24DB37
701,701,0.0,0.0,0.0,1.0,0.0,1.0,0.0,0.0,0.0,0.0,0.0,0.0,The cozy vibe of this kitchen is perfectly complemented by its clear vases.,wants warm minimalism and neutral colors,#BDEACA, #0A9C9C, #63A791
702,702,0.0,1.0,0.0,0.0,1.0,0.0,0.0,0.0,0.0,0.0,0.0,0.0,"Designed with an utilitarian aesthetic, this living room showcases linen rugs alongside vintage lighting.","wants a modern, urban atmosphere",#714122, #07D32C, #1D2773
703,703,1.0,0.0,0.0,0.0,0.0,0.0,0.0,0.0,1.0,0.0,0.0,0.0,"Beautifully styled, this bathroom offers sturdy table legs paired with woven baskets in a cozy setting.",loves eclectic vibes and cozy textures,#3DE462, #FC80B3, #ABA3BB
704,704,0.0,0.0,1.0,0.0,0.0,0.0,1.0,0.0,0.0,0.0,0.0,0.0,The clean vibe of this living room is perfectly complemented by its worn stools.,wants a calm and functional design,#2DD52B, #1F84EF, #E21E21
705,705,1.0,0.0,0.0,0.0,0.0,0.0,0.0,1.0,0.0,0.0,0.0,0.0,"The interior of this living room uses smooth fireplaces heavily, creating a bohemian atmosphere complete with vintage finds.",loves eclectic vibes and cozy textures,#96FF6E, #D7A7A2, #3AEC97
706,706,0.0,1.0,0.0,0.0,0.0,0.0,0.0,0.0,0.0,1.0,0.0,0.0,"Designed with a rugged aesthetic, this kitchen showcases natural cladding alongside open layouts.",likes metal finishes and exposed structures,#4857E6, #8CA870, #B351F4
707,707,0.0,1.0,0.0,0.0,0.0,0.0,0.0,0.0,0.0,0.0,1.0,0.0,"Incorporating factory-style windows, this edgy bathroom focuses on glazed patios to define the bathroom.",likes metal finishes and exposed structures,#9E2070, #98D897, #9EB974
708,708,0.0,0.0,0.0,1.0,1.0,0.0,0.0,0.0,0.0,0.0,0.0,0.0,"This bedroom embraces an airy design, highlighted by linen rugs.",likes cozy atmospheres with functional design,#1F7DBC, #F77CDE, #F3BD0A
709,709,0.0,0.0,0.0,1.0,1.0,0.0,0.0,0.0,0.0,0.0,0.0,0.0,A stunning living room that mixes soft textiles with upholstered armchairs for a truly inviting feel.,likes cozy atmospheres with functional design,#53BE5E, #583BDE, #FF0F76
710,710,1.0,0.0,0.0,0.0,1.0,0.0,0.0,0.0,0.0,0.0,0.0,0.0,"This kitchen embraces an earthy design, highlighted by upholstered armchairs.",prefers natural fabrics and artistic patterns,#267EA9, #CF3F87, #BD8156
711,711,0.0,0.0,1.0,0.0,0.0,1.0,0.0,0.0,0.0,0.0,0.0,0.0,"This living room embraces a clean design, highlighted by sleek vases.",prefers simplicity and neutral palettes,#5286CA, #7CAD9E, #07A5EC
712,712,0.0,0.0,1.0,0.0,0.0,0.0,0.0,0.0,0.0,1.0,0.0,0.0,"Beautifully styled, this bedroom offers rugged cladding paired with functional furniture in a simple setting.",likes clean lines and clutter-free spaces,#D3F414, #61B1BA, #84048F
713,713,0.0,0.0,0.0,1.0,0.0,0.0,0.0,0.0,0.0,1.0,0.0,0.0,"Designed with a cozy aesthetic, this kitchen showcases rugged cladding alongside organic forms.",prefers light woods and natural fabrics,#086880, #FF7914, #8C6F0C
714,714,0.0,1.0,0.0,0.0,0.0,0.0,0.0,0.0,0.0,0.0,1.0,0.0,"The interior of this living room uses ceramic living room islands heavily, creating a warehouse-inspired atmosphere complete with high ceilings.","wants a modern, urban atmosphere",#C7B91B, #26874E, #BE392F
715,715,0.0,0.0,0.0,1.0,0.0,0.0,0.0,0.0,0.0,0.0,1.0,0.0,"This living room embraces an inviting design, highlighted by porcelain flooring.",prefers light woods and natural fabrics,#B38333, #7A03A7, #16018D
716,716,0.0,0.0,0.0,1.0,1.0,0.0,0.0,0.0,0.0,0.0,0.0,0.0,A inviting bedroom featuring plush sofas and functional layouts.,wants warm minimalism and neutral colors,#0F51BF, #2C43A7, #756250
717,717,0.0,0.0,0.0,1.0,0.0,0.0,0.0,0.0,0.0,0.0,0.0,1.0,"Designed with a functional aesthetic, this bedroom showcases carved bed frames alongside muted colors.",wants warm minimalism and neutral colors,#13DB32, #13BDEB, #03556F
718,718,1.0,0.0,0.0,0.0,0.0,0.0,0.0,0.0,0.0,0.0,1.0,0.0,"Designed with a vibrant aesthetic, this kitchen showcases glossy backsplashes alongside colorful rugs.",prefers natural fabrics and artistic patterns,#97FD99, #0F25A3, #0EF1A0
719,719,0.0,0.0,0.0,1.0,0.0,1.0,0.0,0.0,0.0,0.0,0.0,0.0,"Beautifully styled, this kitchen offers reflective partitions paired with functional layouts in a warm setting.",wants warm minimalism and neutral colors,#FEC163, #FFCB97, #18E839
720,720,0.0,0.0,0.0,1.0,0.0,0.0,0.0,0.0,0.0,0.0,1.0,0.0,The warm vibe of this bedroom is perfectly complemented by its geometric bedroom islands.,likes cozy atmospheres with functional design,#3657A8, #1E030E, #2450EA
721,721,1.0,0.0,0.0,0.0,0.0,1.0,0.0,0.0,0.0,0.0,0.0,0.0,The eclectic vibe of this bedroom is perfectly complemented by its glossy doors.,likes vibrant colors and handmade decor,#DBA17A, #CBA472, #1DBE3F
722,722,0.0,0.0,0.0,1.0,0.0,1.0,0.0,0.0,0.0,0.0,0.0,0.0,The hygge vibe of this bedroom is perfectly complemented by its sleek mirrors.,prefers light woods and natural fabrics,#E46FEA, #4B0F82, #9B563C
723,723,1.0,0.0,0.0,0.0,0.0,0.0,0.0,0.0,0.0,1.0,0.0,0.0,"Incorporating potted plants, this earthy kitchen focuses on rugged pillars to define the kitchen.",prefers natural fabrics and artistic patterns,#314E53, #47E33C, #C8F6A1
724,724,0.0,0.0,1.0,0.0,0.0,1.0,0.0,0.0,0.0,0.0,0.0,0.0,"Incorporating clean lines, this sleek bedroom focuses on transparent coffee tables to define the bedroom.",likes clean lines and clutter-free spaces,#85CB33, #769906, #6CA0C5
725,725,0.0,0.0,1.0,0.0,0.0,0.0,0.0,0.0,0.0,0.0,1.0,0.0,A stunning bathroom that mixes bare walls with porcelain flooring for a truly pure feel.,likes clean lines and clutter-free spaces,#35C93B, #E4B229, #E1C186
726,726,1.0,0.0,0.0,0.0,0.0,1.0,0.0,0.0,0.0,0.0,0.0,0.0,"Beautifully styled, this kitchen offers clear mirrors paired with dreamcatchers in a relaxed setting.",likes vibrant colors and handmade decor,#5AE35A, #79FAA5, #7A6889
727,727,0.0,1.0,0.0,0.0,0.0,0.0,0.0,0.0,0.0,0.0,1.0,0.0,The warehouse-inspired vibe of this kitchen is perfectly complemented by its porcelain flooring.,likes metal finishes and exposed structures,#5E2BCB, #11C6A2, #898A42
728,728,0.0,1.0,0.0,0.0,0.0,0.0,1.0,0.0,0.0,0.0,0.0,0.0,A urban bathroom featuring smooth accent chairs and exposed pipes.,"wants a modern, urban atmosphere",#0FC171, #6688E8, #1B62DA
729,729,0.0,0.0,0.0,1.0,0.0,1.0,0.0,0.0,0.0,0.0,0.0,0.0,A cozy kitchen featuring translucent vases and indoor greenery.,wants warm minimalism and neutral colors,#F2DD54, #FE3E12, #28C11A
730,730,0.0,0.0,0.0,1.0,0.0,0.0,0.0,0.0,0.0,0.0,1.0,0.0,A hygge kitchen featuring geometric patios and functional layouts.,prefers light woods and natural fabrics,#158A1B, #988817, #5C0F9D
731,731,0.0,0.0,0.0,1.0,0.0,0.0,0.0,1.0,0.0,0.0,0.0,0.0,"This bathroom embraces a nordic design, highlighted by elegant backsplashes.",likes cozy atmospheres with functional design,#2FFDF2, #CB0969, #024F1B
732,732,1.0,0.0,0.0,0.0,0.0,0.0,0.0,0.0,1.0,0.0,0.0,0.0,A earthy kitchen featuring shiny shelving units and colorful rugs.,prefers natural fabrics and artistic patterns,#8D08B5, #201190, #B1E863
733,733,1.0,0.0,0.0,0.0,0.0,0.0,0.0,0.0,0.0,1.0,0.0,0.0,"Incorporating vintage finds, this unconventional kitchen focuses on rugged steps to define the kitchen.",loves eclectic vibes and cozy textures,#D5BA15, #98F753, #6163F1
734,734,0.0,1.0,0.0,0.0,0.0,0.0,0.0,0.0,1.0,0.0,0.0,0.0,"This living room embraces an urban design, highlighted by brushed hardware.",likes metal finishes and exposed structures,#214F2B, #A31131, #FD1776
735,735,0.0,1.0,0.0,0.0,0.0,0.0,0.0,0.0,0.0,1.0,0.0,0.0,The edgy vibe of this kitchen is perfectly complemented by its rugged pillars.,prefers raw textures and darker tones,#2DF89A, #221DFF, #FC7119
736,736,0.0,1.0,0.0,0.0,0.0,0.0,0.0,0.0,0.0,1.0,0.0,0.0,The warehouse-inspired vibe of this bedroom is perfectly complemented by its rough cladding.,prefers raw textures and darker tones,#2508B6, #AEC7F7, #979042
737,737,0.0,0.0,1.0,0.0,0.0,1.0,0.0,0.0,0.0,0.0,0.0,0.0,"The interior of this bathroom uses clear large windows heavily, creating an understated atmosphere complete with monochrome palettes.",likes clean lines and clutter-free spaces,#97CFD5, #B37E7E, #A7B770
738,738,0.0,0.0,1.0,0.0,1.0,0.0,0.0,0.0,0.0,0.0,0.0,0.0,A serene bathroom featuring textured draperies and monochrome palettes.,likes clean lines and clutter-free spaces,#84694D, #C5B71A, #600E21
739,739,1.0,0.0,0.0,0.0,0.0,0.0,0.0,0.0,0.0,0.0,0.0,1.0,"Incorporating potted plants, this eclectic bedroom focuses on walnut wood shelving to define the bedroom.",prefers natural fabrics and artistic patterns,#A711DC, #B3866B, #F66AB7
740,740,0.0,0.0,1.0,0.0,0.0,0.0,1.0,0.0,0.0,0.0,0.0,0.0,"Incorporating open living room, this sleek living room focuses on worn sofas to define the living room.",likes clean lines and clutter-free spaces,#5F1C46, #4A35B3, #C05866
741,741,0.0,0.0,1.0,0.0,0.0,0.0,1.0,0.0,0.0,0.0,0.0,0.0,A serene bedroom featuring smooth upholstery and monochrome palettes.,wants a calm and functional design,#1163A6, #B2124A, #B3DF2E
742,742,0.0,0.0,1.0,0.0,0.0,0.0,0.0,0.0,0.0,0.0,1.0,0.0,A stunning kitchen that mixes clean lines with geometric shower walls for a truly uncluttered feel.,prefers simplicity and neutral palettes,#D4D6BF, #C72A60, #75228C
743,743,1.0,0.0,0.0,0.0,0.0,0.0,0.0,0.0,0.0,0.0,1.0,0.0,A unconventional kitchen featuring geometric backsplashes and vintage finds.,loves eclectic vibes and cozy textures,#DF5029, #33044A, #E83EE7
744,744,0.0,1.0,0.0,0.0,0.0,0.0,0.0,0.0,1.0,0.0,0.0,0.0,A stunning bedroom that mixes vintage lighting with shiny light fixtures for a truly urban feel.,likes metal finishes and exposed structures,#39F6E6, #A332F0, #835E9C
745,745,0.0,0.0,1.0,0.0,0.0,0.0,0.0,0.0,0.0,1.0,0.0,0.0,A stunning bedroom that mixes open bedroom with rugged flooring for a truly streamlined feel.,wants a calm and functional design,#6DA55D, #B062FA, #5A0C4C
746,746,0.0,0.0,1.0,0.0,0.0,0.0,0.0,0.0,0.0,1.0,0.0,0.0,"Incorporating bare walls, this sleek kitchen focuses on textured pillars to define the kitchen.",likes clean lines and clutter-free spaces,#20BBCD, #5CAA29, #9D27E7
747,747,1.0,0.0,0.0,0.0,0.0,0.0,0.0,0.0,1.0,0.0,0.0,0.0,"Designed with a cozy aesthetic, this kitchen showcases steel staircases alongside dreamcatchers.",likes vibrant colors and handmade decor,#5C72AB, #34F1DC, #26F4E2
748,748,0.0,1.0,0.0,0.0,1.0,0.0,0.0,0.0,0.0,0.0,0.0,0.0,"Designed with an urban aesthetic, this bathroom showcases soft curtains alongside vintage lighting.",likes metal finishes and exposed structures,#CB83A6, #7FCCD8, #BA5609
749,749,0.0,0.0,0.0,1.0,0.0,0.0,0.0,0.0,0.0,1.0,0.0,0.0,"The interior of this living room uses textured cladding heavily, creating a warm atmosphere complete with simple decor.",likes cozy atmospheres with functional design,#56E9BF, #CD6E4F, #B0F028
750,750,0.0,0.0,1.0,0.0,1.0,0.0,0.0,0.0,0.0,0.0,0.0,0.0,A understated bedroom featuring linen blankets and clean lines.,prefers simplicity and neutral palettes,#1C80EB, #AACAEB, #5D771A
751,751,0.0,0.0,0.0,1.0,0.0,0.0,1.0,0.0,0.0,0.0,0.0,0.0,"The interior of this living room uses rich upholstery heavily, creating a functional atmosphere complete with organic forms.",prefers light woods and natural fabrics,#128D7D, #A36A0F, #716B9A
752,752,0.0,1.0,0.0,0.0,0.0,0.0,0.0,0.0,0.0,0.0,1.0,0.0,A edgy kitchen featuring porcelain shower walls and high ceilings.,likes metal finishes and exposed structures,#51FFE1, #C25F7D, #AE9802
753,753,1.0,0.0,0.0,0.0,0.0,0.0,0.0,0.0,0.0,1.0,0.0,0.0,"This living room embraces a bohemian design, highlighted by heavy flooring.",loves eclectic vibes and cozy textures,#9EDAA0, #527B60, #DE91A3
754,754,0.0,1.0,0.0,0.0,1.0,0.0,0.0,0.0,0.0,0.0,0.0,0.0,"Beautifully styled, this bedroom offers linen rugs paired with factory-style windows in a warehouse-inspired setting.",prefers raw textures and darker tones,#3C5ED3, #E16BB7, #39A74E
755,755,1.0,0.0,0.0,0.0,1.0,0.0,0.0,0.0,0.0,0.0,0.0,0.0,"The interior of this living room uses plush blankets heavily, creating an eclectic atmosphere complete with macrame wall hangings.",loves eclectic vibes and cozy textures,#E5E0EB, #AC0506, #E63A50
756,756,1.0,0.0,0.0,0.0,0.0,0.0,0.0,0.0,1.0,0.0,0.0,0.0,The vibrant vibe of this kitchen is perfectly complemented by its brass light fixtures.,loves eclectic vibes and cozy textures,#129A6C, #A1F4DB, #C51A94
757,757,0.0,0.0,0.0,1.0,1.0,0.0,0.0,0.0,0.0,0.0,0.0,0.0,"Beautifully styled, this kitchen offers textured blankets paired with natural light in a cozy setting.",prefers light woods and natural fabrics,#06A423, #0CB329, #05A0B4
758,758,0.0,1.0,0.0,0.0,0.0,0.0,0.0,0.0,0.0,0.0,1.0,0.0,"The interior of this bedroom uses ceramic feature borders heavily, creating a warehouse-inspired atmosphere complete with exposed pipes.","wants a modern, urban atmosphere",#6DBFED, #2CD1F9, #BB9ED1
759,759,1.0,0.0,0.0,0.0,0.0,0.0,0.0,0.0,1.0,0.0,0.0,0.0,"The interior of this bathroom uses industrial frames heavily, creating a cozy atmosphere complete with colorful rugs.",loves eclectic vibes and cozy textures,#5AC86A, #3AD74C, #9D701A
760,760,0.0,0.0,0.0,1.0,0.0,0.0,0.0,0.0,0.0,0.0,1.0,0.0,The hygge vibe of this bedroom is perfectly complemented by its encaustic tile detail.,wants warm minimalism and neutral colors,#EFFA56, #333ADF, #F39B35
761,761,0.0,1.0,0.0,0.0,0.0,0.0,0.0,0.0,0.0,1.0,0.0,0.0,"The interior of this bedroom uses solid fireplaces heavily, creating a rugged atmosphere complete with brick walls.",prefers raw textures and darker tones,#1235B4, #25331A, #F69E21
762,762,0.0,0.0,1.0,0.0,0.0,0.0,0.0,0.0,1.0,0.0,0.0,0.0,The pure vibe of this living room is perfectly complemented by its matte bar stools.,wants a calm and functional design,#149268, #0324A5, #E644BF
763,763,0.0,1.0,0.0,0.0,0.0,1.0,0.0,0.0,0.0,0.0,0.0,0.0,"The interior of this kitchen uses glossy vases heavily, creating an unfinished atmosphere complete with brick walls.",likes metal finishes and exposed structures,#A6A016, #036E73, #458D9C
764,764,0.0,0.0,1.0,0.0,0.0,0.0,1.0,0.0,0.0,0.0,0.0,0.0,The serene vibe of this living room is perfectly complemented by its rich benches.,prefers simplicity and neutral palettes,#60D8DB, #1D452B, #723748
765,765,1.0,0.0,0.0,0.0,0.0,0.0,1.0,0.0,0.0,0.0,0.0,0.0,"Incorporating woven baskets, this relaxed bathroom focuses on classic accent chairs to define the bathroom.",prefers natural fabrics and artistic patterns,#CD4AA8, #932626, #85561B
766,766,0.0,0.0,1.0,0.0,0.0,0.0,0.0,0.0,1.0,0.0,0.0,0.0,"Designed with a pure aesthetic, this bedroom showcases brushed frames alongside open bedroom.",prefers simplicity and neutral palettes,#644E44, #AA7701, #FBF9FF
767,767,0.0,0.0,0.0,1.0,0.0,1.0,0.0,0.0,0.0,0.0,0.0,0.0,"Beautifully styled, this bathroom offers sleek lighting fixtures paired with indoor greenery in an airy setting.",likes cozy atmospheres with functional design,#BA05A6, #69391B, #F8C468
768,768,0.0,0.0,1.0,0.0,1.0,0.0,0.0,0.0,0.0,0.0,0.0,0.0,"This bathroom embraces a streamlined design, highlighted by textured throw pillows.",prefers simplicity and neutral palettes,#57018A, #8E24C1, #1A01EF
769,769,1.0,0.0,0.0,0.0,0.0,0.0,0.0,0.0,0.0,1.0,0.0,0.0,The bohemian vibe of this bathroom is perfectly complemented by its heavy cladding.,loves eclectic vibes and cozy textures,#752B85, #F8B790, #F53168
770,770,0.0,0.0,0.0,1.0,0.0,1.0,0.0,0.0,0.0,0.0,0.0,0.0,"This kitchen embraces a nordic design, highlighted by reflective large windows.",wants warm minimalism and neutral colors,#17FFCA, #F9AA31, #BA65B5
771,771,0.0,1.0,0.0,0.0,0.0,0.0,0.0,0.0,0.0,0.0,0.0,1.0,"The interior of this kitchen uses reclaimed dining tables heavily, creating a bold atmosphere complete with vintage lighting.","wants a modern, urban atmosphere",#C6D521, #6B65E3, #BC0967
772,772,0.0,0.0,0.0,1.0,1.0,0.0,0.0,0.0,0.0,0.0,0.0,0.0,"The interior of this bathroom uses velvet curtains heavily, creating a hygge atmosphere complete with simple decor.",wants warm minimalism and neutral colors,#AEF3B4, #95BFA6, #BAE9A6
773,773,0.0,0.0,1.0,0.0,0.0,0.0,0.0,1.0,0.0,0.0,0.0,0.0,"Designed with an uncluttered aesthetic, this bedroom showcases smooth coffee tables alongside open bedroom.",wants a calm and functional design,#4368FD, #C204C7, #983CE2
774,774,0.0,1.0,0.0,0.0,0.0,0.0,0.0,0.0,1.0,0.0,0.0,0.0,A stunning bedroom that mixes vintage lighting with iron hardware for a truly utilitarian feel.,likes metal finishes and exposed structures,#20D9EF, #F72F7F, #6EF0B6
775,775,0.0,0.0,0.0,1.0,0.0,0.0,0.0,0.0,0.0,1.0,0.0,0.0,The warm vibe of this living room is perfectly complemented by its solid steps.,wants warm minimalism and neutral colors,#FB9F6B, #F700DB, #9EB853
776,776,0.0,1.0,0.0,0.0,0.0,0.0,0.0,0.0,0.0,1.0,0.0,0.0,"Designed with an utilitarian aesthetic, this kitchen showcases rough pillars alongside high ceilings.",likes metal finishes and exposed structures,#41E64E, #5F0641, #C75B88
777,777,0.0,0.0,0.0,1.0,0.0,0.0,1.0,0.0,0.0,0.0,0.0,0.0,"Incorporating simple decor, this warm bedroom focuses on worn accent chairs to define the bedroom.",prefers light woods and natural fabrics,#550CB4, #457287, #76D1E2
778,778,0.0,1.0,0.0,0.0,0.0,0.0,0.0,1.0,0.0,0.0,0.0,0.0,The unfinished vibe of this bathroom is perfectly complemented by its classic accents.,prefers raw textures and darker tones,#F41643, #99A6AA, #E5A50E
779,779,0.0,1.0,0.0,0.0,1.0,0.0,0.0,0.0,0.0,0.0,0.0,0.0,A stunning kitchen that mixes brick walls with upholstered rugs for a truly warehouse-inspired feel.,"wants a modern, urban atmosphere",#1F233C, #EA112E, #7F5F93
780,780,1.0,0.0,0.0,0.0,0.0,0.0,1.0,0.0,0.0,0.0,0.0,0.0,A stunning bedroom that mixes layered patterns with premium accent chairs for a truly vibrant feel.,likes vibrant colors and handmade decor,#757F28, #53CF46, #BB1CB3
781,781,0.0,1.0,0.0,0.0,1.0,0.0,0.0,0.0,0.0,0.0,0.0,0.0,"Beautifully styled, this bedroom offers cotton blankets paired with brick walls in an unfinished setting.",likes metal finishes and exposed structures,#8F7021, #F8BE6E, #39A669
782,782,0.0,1.0,0.0,0.0,1.0,0.0,0.0,0.0,0.0,0.0,0.0,0.0,A rugged living room featuring velvet curtains and open layouts.,prefers raw textures and darker tones,#6BA318, #0BA901, #5BFBF8
783,783,1.0,0.0,0.0,0.0,0.0,0.0,0.0,0.0,0.0,1.0,0.0,0.0,A free-spirited kitchen featuring textured fireplaces and macrame wall hangings.,loves eclectic vibes and cozy textures,#5B0078, #BB87B9, #7EFEA0
784,784,0.0,1.0,0.0,0.0,0.0,1.0,0.0,0.0,0.0,0.0,0.0,0.0,"Designed with a warehouse-inspired aesthetic, this kitchen showcases glossy doors alongside high ceilings.",likes metal finishes and exposed structures,#CCC208, #A089D5, #729B70
785,785,1.0,0.0,0.0,0.0,0.0,0.0,0.0,0.0,1.0,0.0,0.0,0.0,"Incorporating potted plants, this earthy kitchen focuses on matte staircases to define the kitchen.",loves eclectic vibes and cozy textures,#45BD96, #4DF47B, #57013C
786,786,0.0,0.0,1.0,0.0,0.0,0.0,0.0,1.0,0.0,0.0,0.0,0.0,"This kitchen embraces a clean design, highlighted by cold backsplashes.",wants a calm and functional design,#48B399, #8B3003, #BE244F
787,787,0.0,0.0,1.0,0.0,0.0,0.0,1.0,0.0,0.0,0.0,0.0,0.0,"Beautifully styled, this bedroom offers worn stools paired with open bedroom in a simple setting.",wants a calm and functional design,#27D9B8, #9A328D, #A745D2
788,788,0.0,1.0,0.0,0.0,0.0,0.0,0.0,0.0,0.0,1.0,0.0,0.0,"Beautifully styled, this kitchen offers earthy accent walls paired with vintage lighting in a rugged setting.",likes metal finishes and exposed structures,#6D2329, #F60932, #76CB58
789,789,1.0,0.0,0.0,0.0,0.0,0.0,0.0,0.0,0.0,0.0,0.0,1.0,A unconventional kitchen featuring oak shelves and dreamcatchers.,prefers natural fabrics and artistic patterns,#925224, #417001, #C3EC75
790,790,0.0,0.0,1.0,0.0,0.0,1.0,0.0,0.0,0.0,0.0,0.0,0.0,"The interior of this living room uses translucent doors heavily, creating a streamlined atmosphere complete with geometric shapes.",wants a calm and functional design,#397528, #4AF41C, #36AF5B
791,791,0.0,1.0,0.0,0.0,1.0,0.0,0.0,0.0,0.0,0.0,0.0,0.0,The unfinished vibe of this living room is perfectly complemented by its textured curtains.,likes metal finishes and exposed structures,#A5FB1D, #C5CFA4, #2420FC
792,792,0.0,0.0,1.0,0.0,1.0,0.0,0.0,0.0,0.0,0.0,0.0,0.0,"Designed with a serene aesthetic, this living room showcases woven throw pillows alongside geometric shapes.",prefers simplicity and neutral palettes,#163892, #364728, #BDC6E1
793,793,0.0,0.0,0.0,1.0,0.0,0.0,0.0,0.0,1.0,0.0,0.0,0.0,"Incorporating organic forms, this nordic kitchen focuses on matte table legs to define the kitchen.",likes cozy atmospheres with functional design,#BF7EF0, #1F13B8, #501AC4
794,794,1.0,0.0,0.0,0.0,0.0,0.0,0.0,0.0,0.0,1.0,0.0,0.0,"Incorporating potted plants, this earthy kitchen focuses on natural feature walls to define the kitchen.",loves eclectic vibes and cozy textures,#97BA2E, #A61BD5, #0958CB
795,795,0.0,1.0,0.0,0.0,0.0,0.0,0.0,0.0,0.0,1.0,0.0,0.0,A unfinished kitchen featuring earthy fireplaces and factory-style windows.,"wants a modern, urban atmosphere",#54DF75, #C81BDB, #0A14ED
796,796,0.0,0.0,1.0,0.0,0.0,0.0,0.0,0.0,0.0,1.0,0.0,0.0,"Incorporating functional furniture, this pure living room focuses on rugged cladding to define the living room.",wants a calm and functional design,#6210CF, #2679F1, #E1779B
797,797,0.0,0.0,1.0,0.0,0.0,1.0,0.0,0.0,0.0,0.0,0.0,0.0,A stunning living room that mixes hidden storage with glossy lighting fixtures for a truly pure feel.,wants a calm and functional design,#CF002B, #6D84C8, #3DF007
798,798,0.0,0.0,0.0,1.0,0.0,0.0,0.0,1.0,0.0,0.0,0.0,0.0,"Designed with a bright aesthetic, this kitchen showcases smooth countertops alongside soft textiles.",wants warm minimalism and neutral colors,#0D2332, #5E8F6B, #E52288
799,799,0.0,1.0,0.0,0.0,0.0,0.0,0.0,0.0,1.0,0.0,0.0,0.0,The utilitarian vibe of this bedroom is perfectly complemented by its industrial shelving units.,"wants a modern, urban atmosphere",#7A3F14, #91F56A, #74A991
800,800,1.0,0.0,0.0,0.0,0.0,0.0,0.0,0.0,1.0,0.0,0.0,0.0,"The interior of this kitchen uses sturdy shelving units heavily, creating a relaxed atmosphere complete with woven baskets.",loves eclectic vibes and cozy textures,#3C750A, #D56D37, #F3A8C6
801,801,0.0,1.0,0.0,0.0,1.0,0.0,0.0,0.0,0.0,0.0,0.0,0.0,The raw vibe of this bathroom is perfectly complemented by its linen armchairs.,prefers raw textures and darker tones,#C34E54, #493B5A, #0196F9
802,802,0.0,0.0,0.0,1.0,0.0,0.0,0.0,0.0,0.0,0.0,0.0,1.0,"This living room embraces a bright design, highlighted by oak cabinetry.",wants warm minimalism and neutral colors,#B35AF2, #186D47, #3700BA
803,803,0.0,0.0,0.0,1.0,0.0,0.0,0.0,0.0,0.0,1.0,0.0,0.0,A cozy bathroom featuring earthy flooring and simple decor.,prefers light woods and natural fabrics,#E3B88D, #9978BF, #9C64AA
804,804,1.0,0.0,0.0,0.0,0.0,1.0,0.0,0.0,0.0,0.0,0.0,0.0,"The interior of this kitchen uses glossy vases heavily, creating a relaxed atmosphere complete with layered patterns.",prefers natural fabrics and artistic patterns,#3F2F0A, #960566, #63B725
805,805,0.0,0.0,1.0,0.0,0.0,0.0,0.0,0.0,0.0,0.0,1.0,0.0,A stunning kitchen that mixes monochrome palettes with porcelain flooring for a truly clean feel.,likes clean lines and clutter-free spaces,#32A7F7, #A01BB4, #83EA1F
806,806,0.0,1.0,0.0,0.0,1.0,0.0,0.0,0.0,0.0,0.0,0.0,0.0,A edgy kitchen featuring plush curtains and exposed pipes.,prefers raw textures and darker tones,#625BC4, #352ED2, #0C73EE
807,807,0.0,0.0,1.0,0.0,0.0,0.0,0.0,0.0,1.0,0.0,0.0,0.0,"Beautifully styled, this kitchen offers heavy bar stools paired with open kitchen in a simple setting.",prefers simplicity and neutral palettes,#45F53F, #DA7485, #4219EF
808,808,0.0,1.0,0.0,0.0,0.0,1.0,0.0,0.0,0.0,0.0,0.0,0.0,"Beautifully styled, this kitchen offers glossy lighting fixtures paired with brick walls in a warehouse-inspired setting.",likes metal finishes and exposed structures,#77E32D, #61F212, #5F8F41
809,809,0.0,0.0,0.0,1.0,0.0,0.0,0.0,0.0,1.0,0.0,0.0,0.0,A stunning bathroom that mixes natural light with brass staircases for a truly airy feel.,likes cozy atmospheres with functional design,#C6CF6A, #8675F9, #DB69CD
